{
  "$schema": "https://json-schema.org/draft/2020-12/schema",
  "$id": "runtime_state_v1.schema.json",
  "type": "object",
  "required": [
    "schema_version",
    "generated_at",
    "instance_id",
    "service",
    "env",
    "head_commit",
    "snapshot_seq",
    "safety",
    "metrics",
    "freshness"
  ],
  "additionalProperties": false,
  "properties": {
    "schema_version": {
      "type": "string",
      "const": "runtime_state.v1"
    },
    "generated_at": {
      "type": "string",
      "pattern": "^\\d{4}-\\d{2}-\\d{2}T\\d{2}:\\d{2}:\\d{2}Z$"
    },
    "instance_id": {
      "type": "string",
      "minLength": 1
    },
    "service": {
      "type": "string",
      "minLength": 1
    },
    "env": {
      "type": "string",
      "minLength": 1
    },
    "head_commit": {
      "type": "string",
      "pattern": "^[0-9a-fA-F]{7,40}$"
    },
    "snapshot_seq": {
      "type": "integer",
      "minimum": 0
    },
    "safety": {
      "type": "object",
      "required": [
        "trading_mode",
        "risk_state",
        "mode_reasons",
        "latches",
        "f1_cert_state",
        "owner_view"
      ],
      "additionalProperties": false,
      "properties": {
        "trading_mode": {
          "type": "string",
          "enum": ["NORMAL", "REDUCE_ONLY", "PAUSED", "SHADOW", "KILL"]
        },
        "risk_state": {
          "type": "string",
          "enum": ["HEALTHY", "DEGRADED", "MAINTENANCE", "KILL"]
        },
        "mode_reasons": {
          "type": "array",
          "items": {
            "type": "string"
          }
        },
        "latches": {
          "type": "object",
          "required": [
            "open_permission_latched_off",
            "market_truth_latched"
          ],
          "additionalProperties": false,
          "properties": {
            "open_permission_latched_off": {
              "type": "boolean"
            },
            "market_truth_latched": {
              "type": "boolean"
            }
          }
        },
        "f1_cert_state": {
          "type": "object",
          "required": [
            "status",
            "reason_codes",
            "last_certified_at"
          ],
          "additionalProperties": false,
          "properties": {
            "status": {
              "type": "string",
              "enum": ["VALID", "BLOCKED", "UNKNOWN"]
            },
            "reason_codes": {
              "type": "array",
              "items": {
                "type": "string"
              }
            },
            "last_certified_at": {
              "type": ["string", "null"],
              "pattern": "^\\d{4}-\\d{2}-\\d{2}T\\d{2}:\\d{2}:\\d{2}Z$"
            }
          }
        },
        "owner_view": {
          "type": "object",
          "required": ["unblock_steps"],
          "additionalProperties": false,
          "properties": {
            "unblock_steps": {
              "type": "array",
              "items": {
                "type": "string"
              }
            }
          }
        }
      }
    },
    "metrics": {
      "type": "object",
      "required": [
        "mm_util",
        "disk_used_pct",
        "wal_queue_depth",
        "ws_event_lag",
        "http_429_count",
        "deribit_10028_count",
        "deribit_http_p95"
      ],
      "additionalProperties": false,
      "properties": {
        "mm_util": {"$ref": "#/definitions/metric"},
        "disk_used_pct": {"$ref": "#/definitions/metric"},
        "wal_queue_depth": {"$ref": "#/definitions/metric"},
        "ws_event_lag": {"$ref": "#/definitions/metric"},
        "http_429_count": {"$ref": "#/definitions/metric"},
        "deribit_10028_count": {"$ref": "#/definitions/metric"},
        "deribit_http_p95": {"$ref": "#/definitions/metric"}
      }
    },
    "freshness": {
      "type": "object",
      "required": [
        "expected_publish_interval_s",
        "stale_after_s"
      ],
      "additionalProperties": false,
      "properties": {
        "expected_publish_interval_s": {
          "type": "integer",
          "exclusiveMinimum": 0
        },
        "stale_after_s": {
          "type": "integer",
          "exclusiveMinimum": 0
        }
      }
    }
  },
  "definitions": {
    "metric": {
      "type": "object",
      "required": [
        "value",
        "unit",
        "threshold_state",
        "reason",
        "updated_at"
      ],
      "additionalProperties": false,
      "properties": {
        "value": {
          "type": ["number", "null"]
        },
        "unit": {
          "type": "string",
          "minLength": 1
        },
        "threshold_state": {
          "type": "string",
          "enum": ["OK", "WARN", "CRIT", "UNKNOWN"]
        },
        "reason": {
          "type": "string"
        },
        "updated_at": {
          "type": "string",
          "pattern": "^\\d{4}-\\d{2}-\\d{2}T\\d{2}:\\d{2}:\\d{2}Z$"
        }
      }
    }
  }
}
